{"record_digest":"7cf9c57f73a93ca88347230956abb624fabb385e06c9bb797f0714f6645a1727","proposed":3,"replacements":[{"field":"/summary","section_digest":"70446f4f33a055f8acd235053d45439e6a95b5c4af8ef52277a28d605e93d885","text":"The grilling board sent a typed answer to its slower expert seat only when the answer marked or opened a decision. Now the expert weighs every answer with a note or free text. Typed answers on the board's map can no longer trigger its escalation rules. The code for those rules remains."},{"field":"/changes/0/text","section_digest":"c7d1b4bda5279d741ccd19aa386a9e538f6064456c81b4f72259caf036b190e8","text":"The expert now weighs every human answer with a note or free text."},{"field":"/changes/1/text","section_digest":"d80c6248063293a5801867fa2ebd4672b1914d7855736cf00bf33b9652eada1c","text":"A typed answer that opens nothing runs at the task effort. On a channel the human moved to the expert, it keeps the heavy effort."}],"questions":[{"field":"/summary","question":"Please move the caveat that the escalation rules' code remains into its own Heads-up row."},{"field":"/heads_up/0","question":"Please add the caveat that the map's escalation rules' code remains. This caveat currently appears in the summary."},{"field":"/design_notes","question":"Please add a Heads-up row for the caveat that the map's prose escalation conditions are unreachable, while their code and the page's map-toggle highlight remain."},{"field":"/commit/verification","question":"Please add a Heads-up row for the caveat that the map's escalation rules are unreachable while their code remains."}]}