{"record_digest":"1165715bd587917d3883d1864962e626853ca4c562a6ba059523098e07034edc","proposed":6,"replacements":[{"field":"/summary","section_digest":"e62e3f99c6fca99e1d1f9f582b693c30678aa4b458561c30770cb9ca27cac06a","text":"The agent running a review round chose each reviewer's effort and tools. The panel's configuration file now pins effort and tools for every reviewer slot. Each reviewer receives the change as a diff file. The recovery sequence sets how a run that dies is retried. The panel does not yet check whether a run used its pinned effort."},{"field":"/heads_up/0","section_digest":"5a68f3c5f8b5035ab2171bd122fb8005a4567ae7f96d8732eec2af8f387ecbc8","text":"The gates ran with the system bash first on PATH. The Homebrew bash hangs one hook test."},{"field":"/heads_up/1","section_digest":"21e9779c8d1e09bb0ba059b9347151975a50aa9ce2beb7d1e3c2f963209d5159","text":"The code reviewers last judged commit e399db1d. Four prose-only commits followed."},{"field":"/heads_up/2","section_digest":"f44806195d9bacecc553ba9121e8cd2e82f0b8f7dbceee1b89205e5176ad83c8","text":"The author's machine holds the 27 raw answers that test the written dispatch rules. They are outside the repository."},{"field":"/risk/rows/0/failure","section_digest":"6d22fc7f4ebaca1b9e3897612b6ad8cb54aa8af01802d83a7e4a4ef3db09d26c","text":"A reviewer runs at an effort level or with tools it cannot use."},{"field":"/changes/2/text","section_digest":"a5c6b9e783b6abb443a0d862f249994abd59728b88603eea46ea62f52160e805","text":"The system retries a run that died one effort step lower. It then retries on the other provider. The round halts if that attempt dies too."}],"questions":[{"field":"/risk/rows/0/evidence","question":"The tests establish that every slot has a pin, but do they establish that a reviewer cannot run with incompatible effort or tools? Please provide evidence for that risk or revise the evidence claim."},{"field":"/changes/2/text","question":"Please move the caveat that the round halts only when the last failure on every route was a run that died or a transport error to a Heads-up row. The current change text omits this limiting condition to meet the one-clause-per-sentence check."}]}