{"record_digest":"186f0cecef65c31066357ccd801a25e9bcab52dee0265bb349f61a6f9a87b8e4","proposed":16,"replacements":[{"field":"/pr/title","section_digest":"bf67921d1d87e27cbdef30018bdcf6c1474a61fb4fa887b033fb9918b640d1f4","text":"feat(acceptance-criteria): the attack panel files coverage gaps under one rule only [9k9.405.14]"},{"field":"/work_item/gloss","section_digest":"a94d7c48903782a6f4481fcc59e68e6b60ea085e35c434bee6c07386f9e2a7ef","text":"two overlapping criteria-standard rules ask different questions"},{"field":"/summary","section_digest":"bc04e2befc036f1fed9d4a4dd17f28dc4249794a3e50e56a47121eb9d3d526bd","text":"The acceptance-criteria standard has a coverage rule that asks whether each commitment has a criterion. Another rule opened with a sentence that held this question. Its reviewer filed coverage gaps under that rule. The rule now asks only what check each criterion names. On the corrected control document, 9 of 10 panel runs return an empty report, up from 2 of 10. All 10 runs on the defective document still object to the planted criterion."},{"field":"/heads_up/0","section_digest":"774413bec9a2c1686e484d65efb66ff60d1a27bd0e888fcb431277f39a1129b9","text":"The run records behind the numbers are in an untracked scratch directory on the author's machine."},{"field":"/heads_up/1","section_digest":"1cccd827f65136d48b202c4a0030b5191a618b44669efc0e92c0bf55e6d25a6f","text":"Every existing attack record's fingerprint changes. The emitted prompt includes the rule text."},{"field":"/risk/rows/0/failure","section_digest":"f270c414273a15d9f6501f7441666f4b63f2021dd9d28be6be086d5d545ff806","text":"The panel stops catching a defect it caught before."},{"field":"/risk/rows/0/exposed","section_digest":"aab5a44b2b24f0d4fafcd797472a161e3deddbfc88f5484975e0598dd4f58a6d","text":"Every spec attacked with the deployed standard, in every project."},{"field":"/risk/rows/0/evidence","section_digest":"2c7665a71b85f77a95ee8735e25eaab0307c5d91a64663fffa9a8b3598ae8e22","text":"All 10 runs on the defective document still objected to the planted criterion under the planted rule."},{"field":"/risk/rows/1/failure","section_digest":"d2c4999382fe11430045c22e5641ab41416dd9556ad80109aedb9a1c31f6aa0f","text":"The gain on the control document is noise."},{"field":"/risk/rows/1/exposed","section_digest":"d1643dcfe81b2730e138a8d08ec53ffe49cabd00421aa1eb4116842f38fcccc6","text":"The owner, who would believe the panel is quieter than it is."},{"field":"/risk/rows/1/evidence","section_digest":"2f217f97454d1918a93f26923dc81015d05e8b7d488bae30137db545f1a10741","text":"Ten runs per document used the same model and effort. The one remaining control objection cites a flaw present in both document versions."},{"field":"/changes/0/text","section_digest":"6d06f1528f7f1d6fcb3e728ef8edc08a50938fbd0703f3ca6111914635f352ea","text":"The `verification-contract` rule opened with a sentence that held the coverage rule's question. It now judges each criterion's own check. It sends the other question to coverage."},{"field":"/changes/1/text","section_digest":"45df2e71f277fcf45d3a28473b73654e3b69b3f7adaf3f2de0d56875ab9f17ff","text":"The attack skill's table gains a column naming what each reviewer reads. That unit decides who owns a rule."},{"field":"/design_notes","section_digest":"3f7532a53be745a18cc8c4190934a61d3c57ed3db4f705570739bb007d38b476","text":"The `verification-contract` rule opened by saying that every material commitment has a feasible check. That sentence holds the coverage rule's question. The reviewer that owns `verification-contract` filed coverage gaps under it. On the pilot's second case, 18 of 20 runs raised such objections under the rule as it was.\n\nEach attack-panel reviewer is defined by the unit it reads. One reads a single criterion on its own shape. One reads the set against the document's promises. One reads the set against itself. One asks a single criterion what it leaves untested. The unit decides which reviewer owns a rule. Two reviewers may share ground when one asks about a criterion and the other about the set.\n\nThe measurement used the pilot's second case. The case is a realistic document of eight criteria with one planted defect and a corrected control. Ten fresh runs per document read prompts emitted from each standard version. Before and after the change, 10 of 10 defective runs objected to the planted criterion under the planted rule. 1 of 10 defective runs objected elsewhere, down from 10 of 10. 9 of 10 control runs returned an empty report, up from 2 of 10. The one remaining control objection cites a contradiction present in both test-document versions.\n\nNo reviewer prompt changed. No existing attack record is reopened. The record check binds to the document's revision and never to the rule text. Other sentences in the attack skill were shortened to keep its body under the size cap."},{"field":"/criteria/0/promise","section_digest":"9007654180519ee3a3a3d147086f1f174e61511ef0fe938860342ac410e53d01","text":"The `verification-contract` rule judges whether each criterion names a feasible and complete check. It sends the question of whether a commitment has a criterion to coverage."},{"field":"/criteria/1/promise","section_digest":"3833ed2d1b12326d378848d5c1e6a6550fe9ab8eb00d6c6cecd9a06de7772cf8","text":"The attack skill states the unit each reviewer reads beside its reviewer table."},{"field":"/criteria/2/promise","section_digest":"9312fecf16d3ade84eff17b67346c16d5158f56f5c37b10af74ba1d685aaaf5e","text":"At least 8 of 10 control runs come back empty. At least 8 of 10 defective runs object to the planted criterion."},{"field":"/commit/why","section_digest":"535bef9dbf1ac64ce3dc0c72ee19e001344c067f37218c49da672b038cfd7390","text":"A rule in the acceptance-criteria standard opened with a sentence that held the coverage rule's question. Its reviewer filed coverage gaps under that rule. On the corrected control document, only 2 of 10 runs came back empty."},{"field":"/commit/change","section_digest":"c6ca01b6e3614a53d5f2cb2a2447af762bbf908e7c3305f8ad0f5e19e9952e44","text":"The verification-contract rule now judges the check each criterion names. The coverage rule still asks whether a commitment has a criterion. The attack skill's reviewer table names what each reviewer reads. That unit decides who owns a rule."},{"field":"/commit/verification","section_digest":"b12b6dad1ca680b2c111e5ec76f7598f20452fcd2cd5bf1b105d7506fccc7e87","text":"`make ci` exits 0. On the pilot's second case, ten runs per document produced an empty control report in 9 of 10 runs. All 10 runs detected the planted defect. One prose review round came back clean."}],"questions":[{"field":"/summary","question":"Please add a separate Heads-up row for the remaining control objection: it cites a contradiction present in both document versions."}]}