{
  "record_digest": "186f0cecef65c31066357ccd801a25e9bcab52dee0265bb349f61a6f9a87b8e4",
  "proposed": 14,
  "replacements": [
    {
      "field": "/summary",
      "section_digest": "bc04e2befc036f1fed9d4a4dd17f28dc4249794a3e50e56a47121eb9d3d526bd",
      "text": "The acceptance-criteria standard's coverage rule asks whether a commitment has a criterion at all. Another rule's reviewer filed coverage gaps under it because of the same question in its opening sentence. That rule now asks only about each criterion's check. 9 of 10 reviewer panel runs on the corrected control document now return an empty report, up from 2 of 10. All 10 runs on the defective document still object to the planted criterion."
    },
    {
      "field": "/heads_up/1",
      "section_digest": "1cccd827f65136d48b202c4a0030b5191a618b44669efc0e92c0bf55e6d25a6f",
      "text": "Every existing attack record's fingerprint changes because of the rule text in each emitted prompt."
    },
    {
      "field": "/risk/rows/0/exposed",
      "section_digest": "aab5a44b2b24f0d4fafcd797472a161e3deddbfc88f5484975e0598dd4f58a6d",
      "text": "Every specification reviewed against the deployed standard, in every project."
    },
    {
      "field": "/risk/rows/1/exposed",
      "section_digest": "d1643dcfe81b2730e138a8d08ec53ffe49cabd00421aa1eb4116842f38fcccc6",
      "text": "The owner, through a mistaken belief in a quieter panel."
    },
    {
      "field": "/risk/rows/1/evidence",
      "section_digest": "2f217f97454d1918a93f26923dc81015d05e8b7d488bae30137db545f1a10741",
      "text": "Ten runs per document used the same model and effort. The one remaining control objection cites a flaw present in both document versions."
    },
    {
      "field": "/changes/0/text",
      "section_digest": "6d06f1528f7f1d6fcb3e728ef8edc08a50938fbd0703f3ca6111914635f352ea",
      "text": "The `verification-contract` rule (the rule for judging each criterion's check) opened with the coverage rule's question. It now opens by judging each criterion's own check. It sends the question of a commitment having a criterion to coverage."
    },
    {
      "field": "/changes/1/text",
      "section_digest": "45df2e71f277fcf45d3a28473b73654e3b69b3f7adaf3f2de0d56875ab9f17ff",
      "text": "The instructions for running the reviewer panel gain a column in their reviewer table. The column names each reviewer's reading unit. That unit decides rule ownership."
    },
    {
      "field": "/design_notes",
      "section_digest": "3f7532a53be745a18cc8c4190934a61d3c57ed3db4f705570739bb007d38b476",
      "text": "The `verification-contract` rule opened with a requirement for a feasible check for every material commitment. Its reviewer filed coverage gaps under `verification-contract` because of that coverage question. 18 of 20 runs on the pilot's second case raised such objections under the original rule.\n\nEach reviewer in the panel is defined by its reading unit. One examines a single criterion's form. One checks the set against the document's promises. One checks the set against itself. One examines a single criterion for untested cases. That unit decides rule ownership. Two reviewers may share ground through their different views of a criterion and the set.\n\nThe measurement used the pilot's second case and a corrected control. The second case is a realistic document of eight criteria with one planted defect. Ten fresh runs per document read prompts emitted from each version of the standard. 10 of 10 defective runs objected to the planted criterion under the planted rule, before the change and after it. 1 of 10 defective runs objected elsewhere, down from 10 of 10. 9 of 10 control runs returned an empty report, up from 2 of 10. The one remaining control objection cites a contradiction present in both versions of the test document.\n\nNo reviewer prompt changed. No existing attack record is reopened because of the record check's binding to the document's revision and never to the rule text. Other sentences in the panel's instructions were shortened to keep the instructions under the size cap."
    },
    {
      "field": "/criteria/0/promise",
      "section_digest": "9007654180519ee3a3a3d147086f1f174e61511ef0fe938860342ac410e53d01",
      "text": "The `verification-contract` rule judges each criterion's named check for feasibility and completeness. It sends the question of a commitment having a criterion to coverage."
    },
    {
      "field": "/criteria/1/promise",
      "section_digest": "3833ed2d1b12326d378848d5c1e6a6550fe9ab8eb00d6c6cecd9a06de7772cf8",
      "text": "The instructions for running the reviewer panel state each reviewer's reading unit beside the reviewer table."
    },
    {
      "field": "/criteria/2/promise",
      "section_digest": "9312fecf16d3ade84eff17b67346c16d5158f56f5c37b10af74ba1d685aaaf5e",
      "text": "At least 8 of 10 control runs come back empty. At least 8 of 10 defective runs object to the planted criterion."
    },
    {
      "field": "/commit/why",
      "section_digest": "535bef9dbf1ac64ce3dc0c72ee19e001344c067f37218c49da672b038cfd7390",
      "text": "One rule in the acceptance-criteria standard opened with the coverage rule's question. Its reviewer filed coverage gaps under it because of that overlap. Only 2 of 10 runs on the corrected control document came back empty."
    },
    {
      "field": "/commit/change",
      "section_digest": "c6ca01b6e3614a53d5f2cb2a2447af762bbf908e7c3305f8ad0f5e19e9952e44",
      "text": "The verification-contract rule (the rule for judging each criterion's check) now opens by judging each criterion's named check. The question of a commitment having a criterion at all stays with the coverage rule. The instructions for running the reviewer panel name each reviewer's reading unit in the reviewer table. That unit decides rule ownership."
    },
    {
      "field": "/commit/verification",
      "section_digest": "b12b6dad1ca680b2c111e5ec76f7598f20452fcd2cd5bf1b105d7506fccc7e87",
      "text": "make ci exits 0. 9 of 10 control runs returned an empty report in the pilot's second case, with ten runs per document. 10 of 10 runs detected the planted defect. One prose review round came back clean."
    }
  ],
  "questions": [
    {
      "field": "/pr/title",
      "question": "How should the required first-use gloss for 9k9.405.14 be accommodated while preserving the closing bracketed id and restricting edits to the wording before it?"
    },
    {
      "field": "/commit/subject",
      "question": "How should the required first-use gloss for 9k9.405.14 be accommodated within the 100-character limit while preserving the subject prefix and closing bracketed id?"
    },
    {
      "field": "/heads_up/1",
      "question": "What does an attack record's fingerprint identify? The record does not supply a definition for its first use."
    },
    {
      "field": "/risk/rows/1/evidence",
      "question": "Please add a separate Heads-up row for the remaining control objection to a flaw present in both document versions. No existing Heads-up row covers this caveat."
    }
  ]
}