{"record_digest":"bb68ae43bd55975505d92d7537d72db488d1443f853c2406528c043c1caeadd3","proposed":13,"replacements":[{"field":"/summary","section_digest":"c688dc7904ae053a51f3da21dcb4a53df594f927b231b2c33ad31cd11e74cab4","text":"The delegation skill uses the routing table as its only inventory of model ids. No check enforced that rule. A new test suite reads Markdown files under `src/`, except files under an `evals` or `node_modules` directory. It fails `make ci` when a file names a model id the table omits. Anthropic aliases such as `sonnet` are not caught."},{"field":"/risk/rows/0/failure","section_digest":"14dae3b25507ce6f19322c825a1daf4061a7b8b0cfbdddacdbe6db1dcdbfb01d","text":"The lint rejects a word that is not a model id. It blocks every pull request."},{"field":"/risk/rows/0/exposed","section_digest":"e9b84f0e02c29a7b7b7d95f5d7eeb282cf5332654d52b9e3dd1efe51c99de642","text":"Anyone who opens a pull request in this repository."},{"field":"/risk/rows/0/evidence","section_digest":"e4e652706a0bc54e694c87f612e4805a9018744afef1b98e8fc30b1c144cb299","text":"The patterns are case-sensitive. The real tree of 94 files lints clean."},{"field":"/risk/rows/0/recovery","section_digest":"57b5ef5e6827a9b71e8f96369b02f3e8408d26d2ce2984b702fdd98272670c27","text":"Delete the test file. Nothing ships from it."},{"field":"/risk/rows/1/failure","section_digest":"ed0d5ba1e725b28f0570a30aca3286cc99256c404721dbda6ae2a6a5b8a05482","text":"A stale model id ships in a skill."},{"field":"/risk/rows/1/exposed","section_digest":"01e71f862e1aae2671c1ea7708ea4f0a6a77591b3a3413aad1250200893932c9","text":"Every project that installs the skill."},{"field":"/changes/0/text","section_digest":"27153b2419b2c8bfd1f0235ff52922c4d64ba2610fec9f111481f1ef964d30a2","text":"A pytest suite beside the delegation skill fails when it finds an unlisted model id. It also fails when a table row elsewhere names any id. It fails when the routing table changes shape."},{"field":"/changes/1/text","section_digest":"2e0def8823310cda9fc7988c8fccc0496ef15cc5edc3ee2511ab7a01e67658fe","text":"Each vendor naming scheme has one case-sensitive pattern. A family name in prose is not an id."},{"field":"/changes/2/text","section_digest":"7106267a4b7c81e14fc67720ad37266acbe9b056d06647abe57c748106e782f6","text":"The routing file's Providers table became a list. The lint allows two tables there."},{"field":"/commit/change","section_digest":"1fc1557208855e5f2bda009d4ab0e68f9de71602b90f5f83375fc14970b8e452","text":"A pytest suite beside the delegation skill reads every Markdown file under `src/`, except files under an `evals` or `node_modules` directory. It fails when a file names a model id absent from the routing table. It also fails when a table row elsewhere names a model id. It fails when the routing table changes shape. The Providers table in the routing file becomes a list, because the lint allows two tables there."},{"field":"/commit/verification","section_digest":"e18309e147af46095ddceabe921bbbe68910073084ebb396ea5c7968b73cc2a9","text":"`make ci` exits 0 at the head, with 20 content suites passing. All 34 cases fail against a stub lint and pass at the head. One unlisted id appended to a skill made the gate exit 2 and name the line. Anthropic aliases are not caught. No review round ran."}],"questions":[{"field":"/heads_up/0","question":"Please add a separate Heads-up row for the caveat that Anthropic aliases such as `sonnet` are not caught."},{"field":"/risk/rows/0","question":"The risk claims the lint can reject a non-id and block every pull request, while the evidence only says the patterns are case-sensitive and the real tree lints clean. What evidence supports this failure claim?"},{"field":"/risk/rows/1","question":"Please add a separate Heads-up row for the caveat that a table row naming only an Anthropic alias is not caught."}]}