{"record_digest":"186f0cecef65c31066357ccd801a25e9bcab52dee0265bb349f61a6f9a87b8e4","proposed":6,"replacements":[{"field":"/summary","section_digest":"bc04e2befc036f1fed9d4a4dd17f28dc4249794a3e50e56a47121eb9d3d526bd","text":"The acceptance-criteria standard asks whether each commitment has a criterion, and another rule asks whether each criterion names a check. The second rule opened with a sentence that asked whether a commitment had a criterion, so its reviewer filed coverage gaps under that rule. The second rule now judges the check each criterion names. On the corrected control document, 9 of 10 panel runs returned an empty report, up from 2 of 10. All 10 runs on the defective document still objected to the planted criterion."},{"field":"/heads_up/1","section_digest":"1cccd827f65136d48b202c4a0030b5191a618b44669efc0e92c0bf55e6d25a6f","text":"The rule text is part of each emitted prompt. Every existing attack record's fingerprint changes as a result."},{"field":"/risk/rows/0/evidence","section_digest":"2c7665a71b85f77a95ee8735e25eaab0307c5d91a64663fffa9a8b3598ae8e22","text":"All 10 runs on the defective document still objected to the planted criterion under the planted rule."},{"field":"/risk/rows/1/evidence","section_digest":"2f217f97454d1918a93f26923dc81015d05e8b7d488bae30137db545f1a10741","text":"Ten runs per document used the same model and effort. The one remaining control objection cites a flaw present in both versions of the document."},{"field":"/changes/0/text","section_digest":"6d06f1528f7f1d6fcb3e728ef8edc08a50938fbd0703f3ca6111914635f352ea","text":"The `verification-contract` rule opened with a sentence that asked whether a commitment had a criterion. Its reviewer filed coverage gaps under that rule. The rule now judges each criterion's own check and sends the question of whether a commitment has a criterion to coverage."},{"field":"/changes/1/text","section_digest":"45df2e71f277fcf45d3a28473b73654e3b69b3f7adaf3f2de0d56875ab9f17ff","text":"The attack skill's table gains a column naming what each reviewer reads. That unit determines who owns each rule."}],"questions":[{"field":"/summary","question":"Please move the caveat about the untracked run records into a Heads-up row; the summary's five-sentence limit leaves no room to include it there."},{"field":"/risk/rows/0/evidence","question":"Please move the caveat that existing attack record fingerprints change into a Heads-up row."}]}